slug,name,image,description,play_url,link
scrap-metal-infernal,SCRAP METAL INFERNAL,https://unblocked-games-g-plus.poki2.online/assets/upload/busqueda/jpg/scrap-metal-infernal.jpg,"Main Controls For Playing:  ARROW KEYS, SPACE: brake, SHIFT: grip, I: inventory
Brief Description About The Game:  Welcome to the adrenaline-packed world of “SCRAP METAL INFERNAL: The Ultimate Car Showdown!” Get ready to start your engines and dive headfirst into the heart-pounding action of car destruction! This is not your average race; it’s an infernal trap where four unique machines find themselves caught in a hellish spectacle.   Picture this: towering mountains surround a vast plain, forming the backdrop for the ultimate test of your driving skills. Meet the stars of the show – the Subaru Impreza, the Jeep Monster with colossal wheels, the rugged Lada Niva, and the mighty Jeep Cherokee. Each car brings its own set of strengths and weaknesses, creating a thrilling mix of choices for every daredevil out there.   No boring tasks or goals here – this is all about the pure joy of racing and pushing these mean machines to their limits. Feel the rush as you navigate through roads and conquer treacherous mountains. It’s a wild ride where the only rule is to leave nothing but chaos in your wake!   But here’s the twist – you can experience all the excitement for free and at lightning speed on BUSQUEDA.me! That’s right, get ready to rev up your engines and unleash the chaos without spending a dime. Feel the wind in your hair, hear the roar of the engines, and experience the thrill of SCRAP METAL INFERNAL like never before.   Unlock the true potential of each car as you zoom through the plains and conquer the challenging terrains. Whether you choose the sleek Subaru Impreza or the beastly Jeep Monster, the choice is yours, and the possibilities are endless. Burn rubber, perform stunts, and leave your opponents in the dust as you race towards victory.   So, what are you waiting for? Join the SCRAP METAL INFERNAL car showdown and show the world who the true master of destruction on wheels is. Remember, it’s not just a race – it’s a spectacular display of chaos and mayhem! Play for free, play in fast speed, and let the infernal fun begin!",https://unblocked-games-g-plus.poki2.online/play/scrap-metal-infernal.html,https://sites.google.com/view/unblocked-games-g-site/scrap-metal-infernal
smash-karts,SMASH KARTS,https://unblocked-games-g-plus.poki2.online/assets/upload/busqueda/jpg/smash-karts.jpg,Main Controls For Playing:  Move - WASD or Arrow keys,https://unblocked-games-g-plus.poki2.online/play/smash-karts.html,https://sites.google.com/view/unblocked-games-g-site/smash-karts
ultimate-offroad-simulator,ULTIMATE OFFROAD SIMULATOR,https://unblocked-games-g-plus.poki2.online/assets/upload/busqueda/jpg/ultimate-offroad-simulator.jpg,"Main Controls For Playing:  WASD OR ARROW KEYS FOR PLAYING
Brief Description About The Game:  Are you ready to kickstart your engines and dive into the wild world of ATV Ultimate Offroad? Buckle up, little adventurers, because this is not your average racing game – it’s a thrilling off-road extravaganza that will take you on a ride of a lifetime! Get ready to hit the trails, conquer challenging terrains, and blaze your own trail through the vast and exciting world of off-road excitement.   Picture this: You’re at the starting line, revving your engine with anticipation. The moment you press play on your device, you don’t just start the game – you catapult yourself into the heart of the action! As you enter the ATV Ultimate Offroad universe, get ready to be transported into a world where mud-spattered trails, rocky slopes, and untamed wilderness await your fearless exploration.   Feel the rush as you navigate your ATV through various game modes, from heart-pounding races against other players to the freedom of a free-drive mode where you set your own rules. Want to challenge a friend? No problem! With the 2-player mode, you can go head-to-head in an adrenaline-fueled race to the finish line.   But it’s not just about speed – it’s about unlocking the coolest ATVs in the game. Collect in-game currency and gears by conquering races and exploring the open world. Customize your ride, upgrade your ATV, and show off your unique style as you become the ultimate off-road champion.   Guess what, young thrill-seekers? You can embark on this action-packed journey for free at BUSQUEDA.me! That’s right – experience the excitement in fast speed without spending a single coin. Get ready to race, explore, and conquer the off-road world like never before.   Developed by the masterminds at RHM Interactive, ATV Ultimate Offroad takes off-road gaming to new heights. The game was unleashed upon the world in September 2023, and since then, it’s been captivating the hearts of off-road enthusiasts of all ages.   So, what are you waiting for? Start your engines, dive into the mud, and conquer the off-road challenges that await you in ATV Ultimate Offroad. The thrill is calling – will you answer?",https://unblocked-games-g-plus.poki2.online/play/ultimate-offroad-simulator.html,https://sites.google.com/view/unblocked-games-g-site/ultimate-offroad-simulator
